ID,Type,SKU,Name,Published,Is featured?,Visibility in catalog,Short description,Description,Date sale price starts,Date sale price ends,Tax status,Tax class,In stock?,Stock,Allow customer reviews?,Categories,Regular price,Sale price,Images
,simple,sampoorna-refined-sunflower-oil-pack-of-20-500ml-x-20,"Sampoorna Refined Sunflower Oil (Pack of 20), 500ml x 20",1,1,visible,This is product description,"<p>Iste curae sed a accusantium rerum dui ac itaque, veritatis, repudiandae deleniti perspiciatis placerat, odio fuga orci odio molestie, montes, laoreet culpa habitant labore eu mollitia sodales! Aspernatur dictumst massa velit sollicitudin quam vel placerat, anim, magnam blandit blanditiis dignissim pariatur porro sapien nascetur ullamcorper quod augue luctus mollis magnis, harum fames vero neque, sed? Lectus, voluptatum voluptates laudantium potenti. Ad vitae, sit animi per eaque, delectus saepe, cursus vero expedita aliquam expedita taciti, occaecati voluptatum dui, cupidatat tempore recusandae voluptate aute wisi dis ad, luctus, maecenas? Dignissimos integer pulvinar, suspendisse class cras reprehenderit curabitur? Quisque! Tempora occaecati est leo.</p> <p>Quis fuga eiusmod aperiam voluptate curae vero illo ratione libero, quia praesent euismod voluptate consequat debitis magna! Consectetuer iste! Nullam quas. Nostrud? Minus hendrerit. Tortor lacinia mauris, sollicitudin nonummy quasi, error, aliquip laoreet, recusandae nam potenti? Dui, scelerisque cum cubilia, conubia, enim? Penatibus magna pretium! Orci. Sem molestie pariatur sed eveniet fames turpis interdum! Velit, esse dolore potenti eaque tempor primis maecenas donec parturient unde temporibus viverra beatae cubilia ipsam vulputate per quod maecenas quo cillum! Dignissimos habitasse massa ultrices, tempus, expedita ornare fringilla! Senectus blandit quod voluptatibus fusce assumenda. Condimentum nec ratione, omnis id ridiculus harum fugit, do, integer.</p> <p>Curae praesentium phasellus deserunt donec platea, sequi eiusmod perferendis adipiscing sociosqu erat cum cupiditate mollis soluta irure delectus, elementum occaecati cras sunt etiam integer! Iure deserunt totam blandit, iure adipisicing, assumenda ipsum repellendus? Occaecati! Proident inceptos purus pulvinar pede atque lorem nisl, erat quasi id id, fugiat feugiat? Scelerisque eleifend, commodi, iure ipsum rutrum. Aliquam, facilisis, illo facere aperiam habitant, vitae lobortis eros omnis luctus! Tincidunt eiusmod rerum penatibus molestiae, iste repellendus mollitia dignissimos urna excepturi? Proin turpis, vehicula tenetur fringilla, donec fringilla vitae! Nunc velit commodo magna nostra leo? Dolore rutrum quae laoreet suscipit sociosqu, magnam? Conubia, adipiscing class.</p> <p>Adipisicing platea lorem scelerisque. Dictum nonummy consequatur ipsa varius unde quisquam adipiscing! Earum nobis, explicabo. Qui volutpat, dapibus morbi hymenaeos, modi, maiores praesentium quibusdam. Nunc accusantium. Vero molestiae aptent massa. Hac veniam. Montes ea pariatur voluptatem, veniam, laborum lorem aliquam temporibus adipisci, voluptatibus excepturi quasi elit cursus corporis! Perferendis malesuada adipisci fugit hic vestibulum! Exercitationem. Voluptatum. Repellat, minim ipsum mus, repudiandae praesent distinctio condimentum deserunt, maxime sociis? Irure sociis, molestias, dui fringilla, placeat distinctio nobis parturient taciti fugit? Laborum ipsam? Cursus ad repudiandae, suspendisse, primis, excepturi nostrud, voluptates quasi penatibus impedit sed voluptates per rutrum quaerat dolor! Accumsan repellat sagittis.</p> <p>Ipsam, hac platea occaecati. Aliquip ipsa, molestiae. Quisquam integer, modi sapiente pede, convallis nemo eligendi, inventore, quia feugiat, eaque fusce adipiscing phasellus quidem voluptatem accusantium metus sit turpis volutpat nemo? Doloremque sagittis commodi eaque magni nihil, occaecati malesuada aptent impedit, inventore facilisi autem quaerat volutpat, aliquip ipsam dis, facere ea, fusce error dolor urna! Reiciendis cubilia, nisi maxime! Dictumst. Quisquam? Elit, consequat sit recusandae proident eveniet ut saepe, aptent porro molestias class tellus cumque! Ipsum. Tortor orci lorem torquent exercitation sociosqu convallis natoque feugiat varius sint quam laboriosam tempor sed, tellus natoque quas magnam earum primis? Nascetur aptent! Animi tincidunt.</p> <p>Laborum aliquid, auctor maxime ea eligendi. Ullamco, ridiculus quisque, commodo vel! Ridiculus quisque reiciendis? Harum consequat feugiat, accusantium aliquip dignissim fugit auctor etiam senectus arcu, sunt, reiciendis explicabo laborum. Irure voluptatum beatae malesuada eveniet elementum harum, commodo vivamus sodales proin, unde praesent id mollis hymenaeos quae quisquam tortor magnam, cursus, ex, similique aute dolorem ex omnis culpa pariatur iusto tempore ipsam consequuntur tortor, justo pulvinar ac similique, rerum occaecat iusto mattis primis, reprehenderit porta erat voluptate nisi adipisci, nisi sequi mattis exercitationem, accumsan deserunt, ratione? Molestias? Consectetuer pharetra commodo temporibus! Natus, magnam, orci dicta dolorem esse debitis dignissim! Incididunt, iste.</p> <p>Inceptos dapibus egestas mattis class optio class sit aenean laoreet orci pariatur culpa imperdiet natoque enim asperiores, aspernatur aspernatur cumque! Tempora mollitia justo quos possimus quidem eveniet lacinia etiam diamlorem? Eu facilisis! Fugit molestiae natoque? Tempora, modi exercitation impedit eaque urna mollis fugiat cursus nam rhoncus nec lectus! Proident commodi, autem sed consectetur habitant, auctor quia viverra nisi cum dolore quod ducimus nisl pharetra sint orci nesciunt tortor montes, hendrerit per laoreet. Libero vero adipisicing aliquid perferendis laoreet, doloribus donec? Cupiditate. Luctus posuere vulputate. Incidunt, tempor veniam imperdiet, eum assumenda eleifend! Similique odit excepturi egestas est fermentum repudiandae, autem, suscipit.</p> <p>Aperiam ipsa aliquid nam irure, nesciunt illo ac. Accumsan exercitation elit magnis facere eligendi? Unde laboriosam. Debitis facilisi, massa adipisicing libero duis dolorem adipiscing. Senectus libero? Feugiat! Nostrum, cillum facilisis cras eleifend, voluptates labore sunt varius, ac minima justo semper, cursus nisl proident pulvinar, modi fames impedit dolores ea erat feugiat tortor mattis officiis mollitia error? Tenetur reprehenderit eget iure, integer nulla nascetur saepe, mattis hendrerit voluptates turpis, nisl eget. Hac maecenas. Feugiat incidunt mus molestiae, torquent, eos bibendum anim habitasse cillum. Enim orci integer volutpat congue exercitation, platea quibusdam. Eum cillum congue luctus fuga. Ab, quaerat minus conubia adipisci.</p> <p>Habitant nisi, turpis quibusdam laborum neque deserunt ullam, magnam qui leo modi, molestiae porta, platea? Congue sociosqu lectus. Aliqua conubia totam reprehenderit pariatur ante facere integer morbi! Scelerisque, mauris. Quibusdam nostrum mollis labore, magnam qui ab, culpa sapiente erat dignissimos voluptates minim class porro, sapiente nulla! Condimentum asperiores, animi cras dolor porttitor, mi voluptates soluta magnam cursus. Pariatur quisque distinctio facilisi totam porta sequi platea netus vivamus class, aperiam, rerum! Dignissim dictum. Mollitia ipsa quaerat laboris vulputate, nulla quaerat earum? Interdum quam ipsa lobortis porro sociosqu? Possimus. Nihil? Laudantium quo! Quis incididunt aliquam aute assumenda, doloribus. Occaecat blandit consequatur est.</p> <p>Ea justo possimus eius voluptates modi eros. Mus laboriosam, excepteur, iaculis tellus excepturi hic repudiandae ullamco aperiam? Nesciunt venenatis! Scelerisque aliquid, aptent laborum? Nesciunt! Quibusdam pede enim natus, ratione hymenaeos? Ultrices purus quisque ullamcorper wisi eaque, doloribus reprehenderit dolores eligendi voluptas adipisicing vestibulum, facilis sociis? Excepteur luctus dictumst? Mi, a rhoncus morbi montes nostra, laoreet veniam arcu illo eum doloribus, excepteur earum habitant? Sit necessitatibus ultricies, praesent lobortis, tempora unde voluptates numquam hic fugit rhoncus hymenaeos facilisis tristique, unde maxime porro? Animi, necessitatibus tempora natoque hac nec. Adipisicing hac, urna, eleifend arcu quaerat wisi rerum quod dis eum eu cumque.</p>",,,taxable,,1,100,1,Staples > Cooking Essentials,3136.0000000000005,2800,https://saathimart.com/assets/images/products/1620799568hAqifNj3.jpg
,simple,sunflow-refined-sunflower-oil-1ltr,"Sunflow Refined Sunflower Oil, 1ltr",1,1,visible,This is product description,"<p>Iste curae sed a accusantium rerum dui ac itaque, veritatis, repudiandae deleniti perspiciatis placerat, odio fuga orci odio molestie, montes, laoreet culpa habitant labore eu mollitia sodales! Aspernatur dictumst massa velit sollicitudin quam vel placerat, anim, magnam blandit blanditiis dignissim pariatur porro sapien nascetur ullamcorper quod augue luctus mollis magnis, harum fames vero neque, sed? Lectus, voluptatum voluptates laudantium potenti. Ad vitae, sit animi per eaque, delectus saepe, cursus vero expedita aliquam expedita taciti, occaecati voluptatum dui, cupidatat tempore recusandae voluptate aute wisi dis ad, luctus, maecenas? Dignissimos integer pulvinar, suspendisse class cras reprehenderit curabitur? Quisque! Tempora occaecati est leo.</p> <p>Quis fuga eiusmod aperiam voluptate curae vero illo ratione libero, quia praesent euismod voluptate consequat debitis magna! Consectetuer iste! Nullam quas. Nostrud? Minus hendrerit. Tortor lacinia mauris, sollicitudin nonummy quasi, error, aliquip laoreet, recusandae nam potenti? Dui, scelerisque cum cubilia, conubia, enim? Penatibus magna pretium! Orci. Sem molestie pariatur sed eveniet fames turpis interdum! Velit, esse dolore potenti eaque tempor primis maecenas donec parturient unde temporibus viverra beatae cubilia ipsam vulputate per quod maecenas quo cillum! Dignissimos habitasse massa ultrices, tempus, expedita ornare fringilla! Senectus blandit quod voluptatibus fusce assumenda. Condimentum nec ratione, omnis id ridiculus harum fugit, do, integer.</p> <p>Curae praesentium phasellus deserunt donec platea, sequi eiusmod perferendis adipiscing sociosqu erat cum cupiditate mollis soluta irure delectus, elementum occaecati cras sunt etiam integer! Iure deserunt totam blandit, iure adipisicing, assumenda ipsum repellendus? Occaecati! Proident inceptos purus pulvinar pede atque lorem nisl, erat quasi id id, fugiat feugiat? Scelerisque eleifend, commodi, iure ipsum rutrum. Aliquam, facilisis, illo facere aperiam habitant, vitae lobortis eros omnis luctus! Tincidunt eiusmod rerum penatibus molestiae, iste repellendus mollitia dignissimos urna excepturi? Proin turpis, vehicula tenetur fringilla, donec fringilla vitae! Nunc velit commodo magna nostra leo? Dolore rutrum quae laoreet suscipit sociosqu, magnam? Conubia, adipiscing class.</p> <p>Adipisicing platea lorem scelerisque. Dictum nonummy consequatur ipsa varius unde quisquam adipiscing! Earum nobis, explicabo. Qui volutpat, dapibus morbi hymenaeos, modi, maiores praesentium quibusdam. Nunc accusantium. Vero molestiae aptent massa. Hac veniam. Montes ea pariatur voluptatem, veniam, laborum lorem aliquam temporibus adipisci, voluptatibus excepturi quasi elit cursus corporis! Perferendis malesuada adipisci fugit hic vestibulum! Exercitationem. Voluptatum. Repellat, minim ipsum mus, repudiandae praesent distinctio condimentum deserunt, maxime sociis? Irure sociis, molestias, dui fringilla, placeat distinctio nobis parturient taciti fugit? Laborum ipsam? Cursus ad repudiandae, suspendisse, primis, excepturi nostrud, voluptates quasi penatibus impedit sed voluptates per rutrum quaerat dolor! Accumsan repellat sagittis.</p> <p>Ipsam, hac platea occaecati. Aliquip ipsa, molestiae. Quisquam integer, modi sapiente pede, convallis nemo eligendi, inventore, quia feugiat, eaque fusce adipiscing phasellus quidem voluptatem accusantium metus sit turpis volutpat nemo? Doloremque sagittis commodi eaque magni nihil, occaecati malesuada aptent impedit, inventore facilisi autem quaerat volutpat, aliquip ipsam dis, facere ea, fusce error dolor urna! Reiciendis cubilia, nisi maxime! Dictumst. Quisquam? Elit, consequat sit recusandae proident eveniet ut saepe, aptent porro molestias class tellus cumque! Ipsum. Tortor orci lorem torquent exercitation sociosqu convallis natoque feugiat varius sint quam laboriosam tempor sed, tellus natoque quas magnam earum primis? Nascetur aptent! Animi tincidunt.</p> <p>Laborum aliquid, auctor maxime ea eligendi. Ullamco, ridiculus quisque, commodo vel! Ridiculus quisque reiciendis? Harum consequat feugiat, accusantium aliquip dignissim fugit auctor etiam senectus arcu, sunt, reiciendis explicabo laborum. Irure voluptatum beatae malesuada eveniet elementum harum, commodo vivamus sodales proin, unde praesent id mollis hymenaeos quae quisquam tortor magnam, cursus, ex, similique aute dolorem ex omnis culpa pariatur iusto tempore ipsam consequuntur tortor, justo pulvinar ac similique, rerum occaecat iusto mattis primis, reprehenderit porta erat voluptate nisi adipisci, nisi sequi mattis exercitationem, accumsan deserunt, ratione? Molestias? Consectetuer pharetra commodo temporibus! Natus, magnam, orci dicta dolorem esse debitis dignissim! Incididunt, iste.</p> <p>Inceptos dapibus egestas mattis class optio class sit aenean laoreet orci pariatur culpa imperdiet natoque enim asperiores, aspernatur aspernatur cumque! Tempora mollitia justo quos possimus quidem eveniet lacinia etiam diamlorem? Eu facilisis! Fugit molestiae natoque? Tempora, modi exercitation impedit eaque urna mollis fugiat cursus nam rhoncus nec lectus! Proident commodi, autem sed consectetur habitant, auctor quia viverra nisi cum dolore quod ducimus nisl pharetra sint orci nesciunt tortor montes, hendrerit per laoreet. Libero vero adipisicing aliquid perferendis laoreet, doloribus donec? Cupiditate. Luctus posuere vulputate. Incidunt, tempor veniam imperdiet, eum assumenda eleifend! Similique odit excepturi egestas est fermentum repudiandae, autem, suscipit.</p> <p>Aperiam ipsa aliquid nam irure, nesciunt illo ac. Accumsan exercitation elit magnis facere eligendi? Unde laboriosam. Debitis facilisi, massa adipisicing libero duis dolorem adipiscing. Senectus libero? Feugiat! Nostrum, cillum facilisis cras eleifend, voluptates labore sunt varius, ac minima justo semper, cursus nisl proident pulvinar, modi fames impedit dolores ea erat feugiat tortor mattis officiis mollitia error? Tenetur reprehenderit eget iure, integer nulla nascetur saepe, mattis hendrerit voluptates turpis, nisl eget. Hac maecenas. Feugiat incidunt mus molestiae, torquent, eos bibendum anim habitasse cillum. Enim orci integer volutpat congue exercitation, platea quibusdam. Eum cillum congue luctus fuga. Ab, quaerat minus conubia adipisci.</p> <p>Habitant nisi, turpis quibusdam laborum neque deserunt ullam, magnam qui leo modi, molestiae porta, platea? Congue sociosqu lectus. Aliqua conubia totam reprehenderit pariatur ante facere integer morbi! Scelerisque, mauris. Quibusdam nostrum mollis labore, magnam qui ab, culpa sapiente erat dignissimos voluptates minim class porro, sapiente nulla! Condimentum asperiores, animi cras dolor porttitor, mi voluptates soluta magnam cursus. Pariatur quisque distinctio facilisi totam porta sequi platea netus vivamus class, aperiam, rerum! Dignissim dictum. Mollitia ipsa quaerat laboris vulputate, nulla quaerat earum? Interdum quam ipsa lobortis porro sociosqu? Possimus. Nihil? Laudantium quo! Quis incididunt aliquam aute assumenda, doloribus. Occaecat blandit consequatur est.</p> <p>Ea justo possimus eius voluptates modi eros. Mus laboriosam, excepteur, iaculis tellus excepturi hic repudiandae ullamco aperiam? Nesciunt venenatis! Scelerisque aliquid, aptent laborum? Nesciunt! Quibusdam pede enim natus, ratione hymenaeos? Ultrices purus quisque ullamcorper wisi eaque, doloribus reprehenderit dolores eligendi voluptas adipisicing vestibulum, facilis sociis? Excepteur luctus dictumst? Mi, a rhoncus morbi montes nostra, laoreet veniam arcu illo eum doloribus, excepteur earum habitant? Sit necessitatibus ultricies, praesent lobortis, tempora unde voluptates numquam hic fugit rhoncus hymenaeos facilisis tristique, unde maxime porro? Animi, necessitatibus tempora natoque hac nec. Adipisicing hac, urna, eleifend arcu quaerat wisi rerum quod dis eum eu cumque.</p>",,,taxable,,1,100,1,Staples > Cooking Essentials,302.40000000000003,270,https://saathimart.com/assets/images/products/1621319619sitZyQN7.jpg
,simple,sunflow-refined-sunflower-oil-pack-of-20-500ml-x-20,"Sunflow Refined Sunflower Oil (Pack of 20), 500ml x 20",1,1,visible,This is product description,"<p>Iste curae sed a accusantium rerum dui ac itaque, veritatis, repudiandae deleniti perspiciatis placerat, odio fuga orci odio molestie, montes, laoreet culpa habitant labore eu mollitia sodales! Aspernatur dictumst massa velit sollicitudin quam vel placerat, anim, magnam blandit blanditiis dignissim pariatur porro sapien nascetur ullamcorper quod augue luctus mollis magnis, harum fames vero neque, sed? Lectus, voluptatum voluptates laudantium potenti. Ad vitae, sit animi per eaque, delectus saepe, cursus vero expedita aliquam expedita taciti, occaecati voluptatum dui, cupidatat tempore recusandae voluptate aute wisi dis ad, luctus, maecenas? Dignissimos integer pulvinar, suspendisse class cras reprehenderit curabitur? Quisque! Tempora occaecati est leo.</p> <p>Quis fuga eiusmod aperiam voluptate curae vero illo ratione libero, quia praesent euismod voluptate consequat debitis magna! Consectetuer iste! Nullam quas. Nostrud? Minus hendrerit. Tortor lacinia mauris, sollicitudin nonummy quasi, error, aliquip laoreet, recusandae nam potenti? Dui, scelerisque cum cubilia, conubia, enim? Penatibus magna pretium! Orci. Sem molestie pariatur sed eveniet fames turpis interdum! Velit, esse dolore potenti eaque tempor primis maecenas donec parturient unde temporibus viverra beatae cubilia ipsam vulputate per quod maecenas quo cillum! Dignissimos habitasse massa ultrices, tempus, expedita ornare fringilla! Senectus blandit quod voluptatibus fusce assumenda. Condimentum nec ratione, omnis id ridiculus harum fugit, do, integer.</p> <p>Curae praesentium phasellus deserunt donec platea, sequi eiusmod perferendis adipiscing sociosqu erat cum cupiditate mollis soluta irure delectus, elementum occaecati cras sunt etiam integer! Iure deserunt totam blandit, iure adipisicing, assumenda ipsum repellendus? Occaecati! Proident inceptos purus pulvinar pede atque lorem nisl, erat quasi id id, fugiat feugiat? Scelerisque eleifend, commodi, iure ipsum rutrum. Aliquam, facilisis, illo facere aperiam habitant, vitae lobortis eros omnis luctus! Tincidunt eiusmod rerum penatibus molestiae, iste repellendus mollitia dignissimos urna excepturi? Proin turpis, vehicula tenetur fringilla, donec fringilla vitae! Nunc velit commodo magna nostra leo? Dolore rutrum quae laoreet suscipit sociosqu, magnam? Conubia, adipiscing class.</p> <p>Adipisicing platea lorem scelerisque. Dictum nonummy consequatur ipsa varius unde quisquam adipiscing! Earum nobis, explicabo. Qui volutpat, dapibus morbi hymenaeos, modi, maiores praesentium quibusdam. Nunc accusantium. Vero molestiae aptent massa. Hac veniam. Montes ea pariatur voluptatem, veniam, laborum lorem aliquam temporibus adipisci, voluptatibus excepturi quasi elit cursus corporis! Perferendis malesuada adipisci fugit hic vestibulum! Exercitationem. Voluptatum. Repellat, minim ipsum mus, repudiandae praesent distinctio condimentum deserunt, maxime sociis? Irure sociis, molestias, dui fringilla, placeat distinctio nobis parturient taciti fugit? Laborum ipsam? Cursus ad repudiandae, suspendisse, primis, excepturi nostrud, voluptates quasi penatibus impedit sed voluptates per rutrum quaerat dolor! Accumsan repellat sagittis.</p> <p>Ipsam, hac platea occaecati. Aliquip ipsa, molestiae. Quisquam integer, modi sapiente pede, convallis nemo eligendi, inventore, quia feugiat, eaque fusce adipiscing phasellus quidem voluptatem accusantium metus sit turpis volutpat nemo? Doloremque sagittis commodi eaque magni nihil, occaecati malesuada aptent impedit, inventore facilisi autem quaerat volutpat, aliquip ipsam dis, facere ea, fusce error dolor urna! Reiciendis cubilia, nisi maxime! Dictumst. Quisquam? Elit, consequat sit recusandae proident eveniet ut saepe, aptent porro molestias class tellus cumque! Ipsum. Tortor orci lorem torquent exercitation sociosqu convallis natoque feugiat varius sint quam laboriosam tempor sed, tellus natoque quas magnam earum primis? Nascetur aptent! Animi tincidunt.</p> <p>Laborum aliquid, auctor maxime ea eligendi. Ullamco, ridiculus quisque, commodo vel! Ridiculus quisque reiciendis? Harum consequat feugiat, accusantium aliquip dignissim fugit auctor etiam senectus arcu, sunt, reiciendis explicabo laborum. Irure voluptatum beatae malesuada eveniet elementum harum, commodo vivamus sodales proin, unde praesent id mollis hymenaeos quae quisquam tortor magnam, cursus, ex, similique aute dolorem ex omnis culpa pariatur iusto tempore ipsam consequuntur tortor, justo pulvinar ac similique, rerum occaecat iusto mattis primis, reprehenderit porta erat voluptate nisi adipisci, nisi sequi mattis exercitationem, accumsan deserunt, ratione? Molestias? Consectetuer pharetra commodo temporibus! Natus, magnam, orci dicta dolorem esse debitis dignissim! Incididunt, iste.</p> <p>Inceptos dapibus egestas mattis class optio class sit aenean laoreet orci pariatur culpa imperdiet natoque enim asperiores, aspernatur aspernatur cumque! Tempora mollitia justo quos possimus quidem eveniet lacinia etiam diamlorem? Eu facilisis! Fugit molestiae natoque? Tempora, modi exercitation impedit eaque urna mollis fugiat cursus nam rhoncus nec lectus! Proident commodi, autem sed consectetur habitant, auctor quia viverra nisi cum dolore quod ducimus nisl pharetra sint orci nesciunt tortor montes, hendrerit per laoreet. Libero vero adipisicing aliquid perferendis laoreet, doloribus donec? Cupiditate. Luctus posuere vulputate. Incidunt, tempor veniam imperdiet, eum assumenda eleifend! Similique odit excepturi egestas est fermentum repudiandae, autem, suscipit.</p> <p>Aperiam ipsa aliquid nam irure, nesciunt illo ac. Accumsan exercitation elit magnis facere eligendi? Unde laboriosam. Debitis facilisi, massa adipisicing libero duis dolorem adipiscing. Senectus libero? Feugiat! Nostrum, cillum facilisis cras eleifend, voluptates labore sunt varius, ac minima justo semper, cursus nisl proident pulvinar, modi fames impedit dolores ea erat feugiat tortor mattis officiis mollitia error? Tenetur reprehenderit eget iure, integer nulla nascetur saepe, mattis hendrerit voluptates turpis, nisl eget. Hac maecenas. Feugiat incidunt mus molestiae, torquent, eos bibendum anim habitasse cillum. Enim orci integer volutpat congue exercitation, platea quibusdam. Eum cillum congue luctus fuga. Ab, quaerat minus conubia adipisci.</p> <p>Habitant nisi, turpis quibusdam laborum neque deserunt ullam, magnam qui leo modi, molestiae porta, platea? Congue sociosqu lectus. Aliqua conubia totam reprehenderit pariatur ante facere integer morbi! Scelerisque, mauris. Quibusdam nostrum mollis labore, magnam qui ab, culpa sapiente erat dignissimos voluptates minim class porro, sapiente nulla! Condimentum asperiores, animi cras dolor porttitor, mi voluptates soluta magnam cursus. Pariatur quisque distinctio facilisi totam porta sequi platea netus vivamus class, aperiam, rerum! Dignissim dictum. Mollitia ipsa quaerat laboris vulputate, nulla quaerat earum? Interdum quam ipsa lobortis porro sociosqu? Possimus. Nihil? Laudantium quo! Quis incididunt aliquam aute assumenda, doloribus. Occaecat blandit consequatur est.</p> <p>Ea justo possimus eius voluptates modi eros. Mus laboriosam, excepteur, iaculis tellus excepturi hic repudiandae ullamco aperiam? Nesciunt venenatis! Scelerisque aliquid, aptent laborum? Nesciunt! Quibusdam pede enim natus, ratione hymenaeos? Ultrices purus quisque ullamcorper wisi eaque, doloribus reprehenderit dolores eligendi voluptas adipisicing vestibulum, facilis sociis? Excepteur luctus dictumst? Mi, a rhoncus morbi montes nostra, laoreet veniam arcu illo eum doloribus, excepteur earum habitant? Sit necessitatibus ultricies, praesent lobortis, tempora unde voluptates numquam hic fugit rhoncus hymenaeos facilisis tristique, unde maxime porro? Animi, necessitatibus tempora natoque hac nec. Adipisicing hac, urna, eleifend arcu quaerat wisi rerum quod dis eum eu cumque.</p>",,,taxable,,1,100,1,Staples > Cooking Essentials,3024.0000000000005,2700,https://saathimart.com/assets/images/products/1621313737TpLnmv2H.jpg
